[
  {
    "id": "force-jump",
    "name": "Force Jump",
    "type": "Active",
    "cost": 1,
    "description": "Each character in this unit may  [jump] ."
  },
  {
    "id": "im-going-to-end-this",
    "name": "I'm going to end this",
    "type": "Reactive",
    "cost": 2,
    "description": "After this Unit makes a combat action, it may use this ability. This Unit may change its Active Stance. Then one character in this Unit may make a  [melee]  attack."
  },
  {
    "id": "deflect",
    "name": "Deflect",
    "type": "Reactive",
    "cost": 0,
    "description": "After a  [ranged]  attack targeting a character in this Unit is resolved, this Unit may use this ability. If the attack roll contained one or more  [failure]  results, the attacking Unit suffers  [damage]  [damage] ."
  },
  {
    "id": "this-is-where-the-fun-begins",
    "name": "This is where the fun begins",
    "type": "Identity",
    "cost": 0,
    "description": "Each time a character in this Unit wounds an enemy Unit, after the effect is resolved, refresh  [force] .\n\nAdditionally, at the end of this Unit's activation, if it Wounded one or more Secondary or Primary Units during that activation, each allied Galactic Republic Secondary and each allied Galactic Republic Supporting character may  [dash] . Then, if this Unit wounded one or more Primary Units during its activation, move the Struggle token one space toward your Momentum tokens."
  },
  {
    "id": "dathomirian-dexterity",
    "name": "Dathomirian Dexterity",
    "type": "Active",
    "cost": 1,
    "description": "Each character in this Unit may  [jump] . This Unit may use this ability two times during its activation instead of the normal one."
  },
  {
    "id": "force-push",
    "name": "Force Push",
    "type": "Active",
    "cost": 2,
    "description": "Choose a character in this Unit and an enemy character within  [range] 3 of that character. Push the chosen enemy character  [range] 3 away from the chosen allied character."
  },
  {
    "id": "riposte",
    "name": "Riposte",
    "type": "Reactive",
    "cost": 0,
    "description": "After a  [melee]  attack targeting a character in this Unit is resolved, this Unit may use this ability. If the attack roll contained one or more  [failure]  results, the attacking Unit suffers  [damage]  [damage]"
  },
  {
    "id": "swift-retreat",
    "name": "Swift Retreat",
    "type": "Innate",
    "cost": 0,
    "description": "When a character in this Unit would  [advance] , it may instead  [reposition] ."
  },
  {
    "id": "sith-assassin",
    "name": "Sith Assassin",
    "type": "Identity",
    "cost": 0,
    "description": "When a character in this Unit Wounds an enemy, after the effect is resolved, refresh  [force] . Then, if it Wounded a Primary Unit or Secondary Unit, it may  [reposition]  or  [jump] . Finally, if it Wounded a Primary Unit, refresh  [force] ."
  },
  {
    "id": "force-speed",
    "name": "Force Speed",
    "type": "Active",
    "cost": 1,
    "description": "Each character in this Unit may  [advance] ."
  },
  {
    "id": "whats-the-matter-too-fast-for-you",
    "name": "What's the matter, too fast for you?",
    "type": "Reactive",
    "cost": 2,
    "description": "When a character in this Unit would suffer  [damage]  from a  [melee]  attack, this Unit may use this ability. This Unit suffers half the  [damage]  in the Damage Pool. The attacking Unit duffers the remaining  [damage] ."
  },
  {
    "id": "youll-find-i-have-many-qualities-for-you-to-dislike",
    "name": "You'll find I have many qualities for you to dislike",
    "type": "Innate",
    "cost": 0,
    "description": "While this Unit is not Wounded, characters in this Unit and allied characters within  [range]  2 add [expertise] to their defense rolls."
  },
  {
    "id": "fierce-protector",
    "name": "Fierce Protector",
    "type": "Identity",
    "cost": 0,
    "description": "When another allied Unit is Wounded by an enemy attack, after the effect is resolved, choose a character in this Unit. The chosen character may  [heal]  [heal]  [heal] . Then the chosen character may  [advance]  or  [jump]  and then may make a  [melee]  attack targeting the enemy character that caused the effect."
  },
  {
    "id": "there-is-no-place-to-run",
    "name": "There is no place to run",
    "type": "Active",
    "cost": 2,
    "description": "Choose a character in this Unit and an enemy character within  [range] 3 of that character. Pull the chosen enemy character  [range] 2 toward the chosen allied character. Then the chosen enemy character gains  [exposed] ."
  },
  {
    "id": "revenge-i-must-have-revenge",
    "name": "Revenge, I must have revenge",
    "type": "Innate",
    "cost": 0,
    "description": "When this Unit is wounded by a  [melee]  attack, after the attack is resolved, one character in this Unit may immediately  [dash]  and make a 5 dice  [melee]  attack targeting the character that wounded it."
  },
  {
    "id": "sustained-by-rage",
    "name": "Sustained by rage",
    "type": "Identity",
    "cost": 0,
    "description": "While this unit is not wounded, when it would spend  [force]  to use an ability, it may suffer  [damage]  equal to the cost of the ability instead.\n\nFor every 3  [damage]  this Unit has, characters in this Unit add 1 die to their  [melee]  attack rolls. For each Injured token this unit has, characters in this Unit add 3 dice to their  [melee]  attack rolls."
  },
  {
    "id": "get-a-move-on-soldier",
    "name": "Get a move on, soldier",
    "type": "Tactic",
    "cost": 0,
    "description": "At the start of this Unit's activation, choose a character in this Unit or another allied Galactic Republic character. The chosen character may  [dash]  and may gain  [hunker] ."
  },
  {
    "id": "defensive-maneuver",
    "name": "Defensive maneuver",
    "type": "Active",
    "cost": 1,
    "description": "Each character in this Unit may  [dash] .If any characters  [dash] , this unit gains  [hunker] ."
  },
  {
    "id": "im-always-first-kid",
    "name": "I'm always first, kid",
    "type": "Reactive",
    "cost": 1,
    "description": "If this Unit is not Wounded, after an allied Clone Trooper Supporting Unit within  [range] 3 of this Unit makes a combat action, this Unit may use this ability. One character in this Unit may  [dash] . If it does, it may make a 5 dice  [melee]  or  [ranged]  attack targeting one of the same enemy characters within  [range]  and LOS."
  },
  {
    "id": "bring-it-on-clankers",
    "name": "Bring it on, clankers",
    "type": "Innate",
    "cost": 0,
    "description": "After an allied Clone Trooper unit within  [range] 3 of this Unit gains  [hunker] , one character in that Unit may  [heal] ."
  },
  {
    "id": "brothers-in-arms",
    "name": "Brothers in arms",
    "type": "Innate",
    "cost": 0,
    "description": "While this Unit has one or more  [hunker] , characters in this Unit have Steadfast."
  },
  {
    "id": "roger-roger",
    "name": "Roger, Roger",
    "type": "Tactic",
    "cost": 0,
    "description": "At the start of this Unit's activation, each allied Battle Droid Supporting character within  [range] 4 of a character in this Unit may  [dash] ."
  },
  {
    "id": "tactical-network",
    "name": "Tactical Network",
    "type": "Active",
    "cost": 1,
    "description": "Choose another allied Battle Droid character within  [range] 4. The chosen character may  [dash] , then may gain  [hunker] , remove one condition from itself, or make a 5 dice attack."
  },
  {
    "id": "target-concentrate-all-firepower",
    "name": "Target, concentrate all firepower",
    "type": "Innate",
    "cost": 0,
    "description": "When an allied Battle Droid character makes an attack, if the targeted character is within  [range] 4 of one or more other allied Battle Droid characters, the attacking character adds 1 die to its attack roll."
  },
  {
    "id": "complete-analysis",
    "name": "Complete analysis",
    "type": "Innate",
    "cost": 0,
    "description": "When you spend  [force]  to place this Unit's Order Card in reserve, spend 1 less  [force] ."
  },
  {
    "id": "jet-pack",
    "name": "Jet pack",
    "type": "Active",
    "cost": 1,
    "description": "Each character in this Unit may  [jump] ."
  },
  {
    "id": "mandalorians-are-stronger-together",
    "name": "Mandalorians are stronger together",
    "type": "Reactive",
    "cost": 0,
    "description": "After this Unit makes a move action, it may use this ability. If a character in this Unit is within  [range] 2 of another allied Mandalorian character, this Unit immediately makes a focus action."
  },
  {
    "id": "mandalore-will-survive",
    "name": "Mandalore will survive",
    "type": "Innate",
    "cost": 0,
    "description": "After this Unit makes a focus action, one character in this Unit may  [dash]  and  [heal]  [heal] ."
  },
  {
    "id": "some-of-us-serve-a-higher-purpose",
    "name": "Some of us serve a higher purpose",
    "type": "Innate",
    "cost": 0,
    "description": "Allied Madalorian characters within  [range] 3 of this Unit that are contesting one or more Active objectives have Protection and Steadfast."
  },
  {
    "id": "pride-of-the-mandalore",
    "name": "Pride of the Mandalore",
    "type": "Tactic",
    "cost": 0,
    "description": "At the start of this Unit's activation, choose another allied Mandalorian character. The chosen character may  [jump] ."
  },
  {
    "id": "ive-got-you-in-my-sights",
    "name": "I've got you in my sights",
    "type": "Innate",
    "cost": 0,
    "description": "Characters in this Unit have Sharpshooter [2]. When a character in this Unit makes a  [ranged]  attack, the target does not benefit from Cover. After this Unit makes a focus action, it gains  [hunker] ."
  },
  {
    "id": "pack-hunter",
    "name": "Pack hunter",
    "type": "Innate",
    "cost": 0,